{
  "schema_version": "1",
  "person_slug": "colleague-li-ming",
  "generated_at": "2026-04-29T00:00:00+00:00",
  "source_evidence_pack_version": "v1",
  "mental_models": [
    {
      "title": "问题拆分优先",
      "content": "在技术选型前先充分拆分问题，用最简单方案验证假设，避免过早优化。",
      "claim_ids": [
        "claim-a643cc7a"
      ],
      "confidence": "medium",
      "evidence_summary": "会议和评审记录中的观察。",
      "limits": [
        "不适用于需要从零搭建基础设施的场景。"
      ]
    },
    {
      "title": "可维护性驱动设计",
      "content": "设计方案时以三个月后的可理解性为衡量标准，宁可多花时间写清楚也不留歧义。",
      "claim_ids": [
        "claim-eaaf2719"
      ],
      "confidence": "high",
      "evidence_summary": "多次代码评审记录和文档。",
      "limits": [
        "不影响紧急热修复场景。"
      ]
    }
  ],
  "decision_heuristics": [
    {
      "title": "影响范围驱动",
      "content": "做技术决策前先评估影响的用户数量和范围，按影响大小分配资源和精力。",
      "claim_ids": [
        "claim-92a5e143"
      ],
      "confidence": "high",
      "evidence_summary": "技术评审讨论记录。",
      "limits": [
        "需要完整的用户数据支撑。"
      ]
    },
    {
      "title": "可逆性评估",
      "content": "可逆决策快速推进，不可逆决策拉更多人讨论和评审，降低决策风险。",
      "claim_ids": [
        "claim-0c498daa"
      ],
      "confidence": "high",
      "evidence_summary": "周会发言记录。",
      "limits": [
        "判断可逆性本身需要经验。"
      ]
    },
    {
      "title": "目标对齐优先",
      "content": "遇到分歧时先回到目标层面确认一致，再讨论方案差异，避免陷于细节之争。",
      "claim_ids": [
        "claim-eaac2ca3"
      ],
      "confidence": "high",
      "evidence_summary": "站会和评审中的行为模式。",
      "limits": [
        "需要双方都愿意回到目标层面对话。"
      ]
    }
  ],
  "expression_dna": [
    {
      "title": "类比和场景化表达",
      "content": "技术讨论中倾向使用生活场景类比来解释抽象概念，让非技术背景的人也能理解。",
      "claim_ids": [
        "claim-e5a9b0e3"
      ],
      "confidence": "medium",
      "evidence_summary": "同事观察反馈。",
      "limits": [
        "类比可能不够精确，需要补充技术细节。"
      ]
    },
    {
      "title": "先肯定后改进",
      "content": "评审他人工作时的表达习惯：先指出做得好的部分，然后再提出改进建议，减少防御心理。",
      "claim_ids": [
        "claim-e266a00f"
      ],
      "confidence": "medium",
      "evidence_summary": "代码评审风格观察。",
      "limits": [
        "在紧急情况下可能压缩反馈时间。"
      ]
    }
  ],
  "profile_specific": [
    {
      "title": "代码可维护性执念",
      "content": "对代码可维护性有较高的执念，认为可读性是可维护性的前提，会在注释和命名上投入额外精力。",
      "claim_ids": [
        "claim-eaaf2719"
      ],
      "confidence": "high",
      "evidence_summary": "多次代码评审和文档记录。",
      "limits": [
        "不适用于一次性脚本或原型。"
      ]
    },
    {
      "title": "时间线协作偏好",
      "content": "在协作中注重时间线的明确性，会主动同步预期完成时间和关键里程碑，减少团队不确定性。",
      "claim_ids": [
        "claim-19b3841a"
      ],
      "confidence": "medium",
      "evidence_summary": "团队协作观察。",
      "limits": [
        "外部依赖可能导致时间线调整。"
      ]
    }
  ],
  "pressure_response": [
    {
      "title": "先交付后优化",
      "content": "在截止日期压力下倾向于先交付最小可用版本，标记已知改进点，后续逐步迭代。",
      "claim_ids": [
        "claim-1f0d91d3"
      ],
      "confidence": "medium",
      "evidence_summary": "团队反馈。",
      "limits": [
        "安全关键系统不适用此模式。"
      ]
    }
  ],
  "value_order": [
    {
      "title": "代码质量 > 交付速度",
      "content": "代码质量和可维护性优先于交付速度，但不会为了追求完美而错过合理的发布窗口。",
      "claim_ids": [
        "claim-5c3ec177"
      ],
      "confidence": "medium",
      "evidence_summary": "复盘和决策记录。",
      "limits": [
        "紧急修复场景会临时调整优先级。"
      ]
    }
  ],
  "anti_patterns": [
    {
      "title": "过度架构设计",
      "content": "偶尔对简单问题引入过度复杂的架构设计，增加了不必要的抽象层。",
      "claim_ids": [
        "claim-97cc77ad"
      ],
      "confidence": "low",
      "evidence_summary": "同事反馈，行为频率不高。",
      "limits": [
        "可能只在特定技术领域出现。"
      ]
    }
  ],
  "honest_boundaries": [
    {
      "title": "非工作场景证据不足",
      "content": "李明在工作之外的社交场景、家庭关系和兴趣爱好方面的行为模式缺乏证据，无法构建推断。",
      "claim_ids": [],
      "confidence": "low",
      "evidence_summary": "所有证据均来自工作场景。",
      "limits": [
        "不对非工作场景做任何推断。"
      ]
    },
    {
      "title": "非技术团队协作未知",
      "content": "李明与市场、销售、设计等非技术团队的协作风格和沟通方式缺乏足够证据。",
      "claim_ids": [],
      "confidence": "low",
      "evidence_summary": "目前证据主要来自技术团队内部。",
      "limits": [
        "不对跨职能协作做推断。"
      ]
    },
    {
      "title": "职业早期经历不详",
      "content": "李明职业早期的成长经历、技术积累过程和关键转折点缺乏记录，当前仅覆盖近年工作。",
      "claim_ids": [],
      "confidence": "low",
      "evidence_summary": "缺少职业早期历史材料。",
      "limits": [
        "不对职业成长路径做推断。"
      ]
    },
    {
      "title": "远程协作适应情况未知",
      "content": "李明的远程工作效率、异步沟通风格和虚拟团队协作偏好缺乏直接证据。",
      "claim_ids": [],
      "confidence": "low",
      "evidence_summary": "现有证据均来自线下或同步协作场景。",
      "limits": [
        "不对远程工作模式做推断。"
      ]
    }
  ],
  "scenario_tests": [
    {
      "title": "紧急线上问题",
      "content": "产品发布前发现一个影响 30% 用户的 bug，但不修复也可以发版。",
      "expected_behavior": "会评估影响范围和修复风险，倾向于在可逆的情况下快速修复并发布，同时标记后续改进点。",
      "claim_ids": [
        "claim-92a5e143",
        "claim-0c498daa",
        "claim-1f0d91d3"
      ],
      "confidence": "medium",
      "evidence_summary": "基于多个证据的综合推断。"
    },
    {
      "title": "技术方案分歧",
      "content": "团队在是否引入新框架的问题上产生分歧。",
      "expected_behavior": "会先确认大家对新框架解决的核心问题是否有共识，然后请支持方和反对方分别列出理由和数据，基于影响范围和可逆性做决策。",
      "claim_ids": [
        "claim-eaac2ca3",
        "claim-92a5e143"
      ],
      "confidence": "medium",
      "evidence_summary": "基于决策启发式和表达模式的综合推断。"
    }
  ]
}